CreationDate,Body,OwnerUserId
"2016-04-18 16:28:57","There are a few reasons why people might object to what Kasich said.  


The advice requires her to give something up.  Some people like to go to parties where there's alcohol, and it's not fair that they have to give that up in order to feel safe from crime.  
Many people use ""advice"" as a way to dismiss a problem. A lot of the time, people will say ""just do x"" as a way to dismiss the problem altogether.  My personal mental prototype of this phenomenon has to do with a somewhat esoteric example where in Magic the Gathering a player can fish for information by incorrectly proposing a shortcut, and the response of the community boils down to a dismissive ""Just ask them how many tokens they're making, even if it doesn't matter"".  I personally don't think that Kasich was doing this, but I can understand how some people might associate what he said with that kind of dismissal.
It sounds similar to actual victim blaming.  Some people interpret this to be victim blaming.  I.E. ""It's your fault you got raped because you went out drinking.""  The drinking example is one of the prototypical examples of victim blaming for rape, and I have to believe that it found it's way into the zeitgeist because people have actually used it that way in the past.  I don't believe that Kasich used it in this way, but I can understand why people think about this kind of victim blaming when Kasich said what he said.

","193"
"2016-04-18 16:52:06","It's my understanding that when in international waters you are under the laws of your home country.

If you are American you could carry firearms on the boat, you would have to look up the laws on declaring them before entering any country's waters though. If you are a good rifleman you could probably kill them from several hundred yards out before then get close enough to use their crappy 40 year old AKs that probably haven't been properly cleaned in decades or RPGs. Do you think they can nail you at even 100 yards with one of those?

Just shoot them in the chest or head before they get close enough to get you. 

I'd consult a lawyer before sailing around the world to make sure you are familiar with the laws.

Personally I think it should be legal to blood eagle them, crucify  them on a mast, and cut off their heads but I wouldn't do that.
","7949"
"2016-04-18 17:21:48","`It's my understanding that when in international waters you are under the laws of your home country.`  That doesn't exactly fill me with confidence.  care to validate that statement for us?","193"
"2016-04-18 17:23:18","@samIam For bike theft maybe (but then again, it's different on so many levels including the fact that the advice is typically to get a lock, not to give up riding a bicycle). For the rest, no you don't, certainly not to the same extent and more loudly and forcefully than other responses to the problem…","4533"
"2016-04-18 17:26:07","Of course he is using it that way. He is not offering as a bit of advice to his daughter, it's an answer to a question about “crossing the line”, as a presidential candidate… In this situation, even the very idea of offering advice to the person asking you a question instead of addressing the question itself is already objectionable.","4533"
"2016-04-18 17:34:21","A torpedo or missile and everything that goes with it (fire control system, space in the hull, personnel, maintenance) is actually very very expensive. Much more than paying some insurance premium and/or ransom from time to time. Even a an actual naval gun is expensive (and exports are severely restricted). OTOH, I think there have occasionally been armed guards on ships, but that's not necessarily very effective either.","4533"
"2016-04-18 17:54:46","The reason is because the left, and a certain portion of the progressive right believe that is is the governments job to pro-actively address social problems of those classes seen as vulnerable.  Those people feel that rather than assign any responsibility for a persons health and safety on that persons actions they put it on the state to prohibit situations where health or safety could be endangered.

But that doesn't seem fair since the vulnerable will not have to change themselves but those that are seen as potential predators, but are not predators, would be affected.  The truth is these people are not looking for fairness they are looking for an advantage in the guise of fairness.

The truth is being very drunk makes anyone vulnerable and there is a certain subset of males who are willing to take advantage of that.  Those are both personal choices.  It is not the pack making that decision it is the individual that is doing that.

And as such they see a potential advantage here by attacking Kasich's position of personal responsibility before governmental intervention.  Certainly it does not address the perceived problem of poor sexual decisions and even predatory behavior, which is the solution they are looking for.  Instead it put first individual responsibility of the person to proactively avoid situations that make them vulnerable in the first place.
","169"
"2016-04-18 18:20:52","This comment section is getting too chatty.  [You can hash out your differences on the details in chat](http://chat.stackexchange.com/rooms/38542/discussion-on-answer-by-philipp-why-do-some-criticize-kasichs-advice-to-a-femal).","193"
"2016-04-18 18:21:13","I would probably add that she assumed there would be something there... after all he has been a politician for over 20 years....","169"
"2016-04-18 18:35:27","@PhilLello  I thought JFK was in the realm of well known fact.","169"
"2016-04-18 18:36:41","@Sam I am Perhaps, although Dr. O'roarke at Boston College has an exhaustive list, as far as information allows. This is an answerable question, and I am voting to reopen.","5309"
"2016-04-18 18:38:32","Each government who was a member of the League would send an official representative who would be the equivalent of an ""ambassador"" from his home country. THis is just like the United Nations. Thus, if a government would change, they would officially appoint a new representative. 

Since each government would handle its own internal affairs, the method of choosing the representative was left to the individual government.

League of Nations


  The League would be made up of a General Assembly (representing all
  member states), an Executive Council (with membership limited to major
  powers), and a permanent secretariat.

","7827"
"2016-04-18 19:16:45","@Philipp so NO chinese 'democracy' is a sham.","5639"
"2016-04-18 19:53:33","Thanks for the validation! Do you know any sources I could read having more information about this?","7944"
"2016-04-18 20:02:00","So, I was working on a political manifesto regarding a new ideology I wanted to make for some time, but I am not sure how to actually make the formatting, not do I understand the general structure for such an effort. I wonder: if that was you making the manifesto and not me, what formats and basic structure would you generally use? 
","7862"
"2016-04-18 20:08:56","@BT Sorry, this is all I know about it.","7827"
"2016-04-18 23:31:02","Over the past week, I've seen a couple news stories about Russian aircraft flying unusually near US military personnel, including warships and US aircraft.
What does Russia gain from this, and why are they doing it now (as opposed to, say, three years ago)?
","5609"
"2016-04-18 23:49:21","Read the first sentence Sam I Am.","5510"
"2016-04-19 01:08:08","They're trying to show off, and show to the rest of the world that they are powerful etc. The reasons for why they are doing this are becuase of disagreements the US and western Europe currently have with them. These are: Syria, Ukraine, and Cold War 2.0. 

Syria: The US and their coalition and Russia aren't happy with each other because they support different groups fighting in the region.

Ukraine: Becuase NATO and the US claim that Russia has annexed crimea, while Russia denies that. Also the shooting down of MH 17 is a point of conflict between the two sides.

Cold War 2.0: NATO has increased military exercises and troop numbers along the NATO border with Russia, in countries like Latvia, Lithuania and Estonia.
","7951"
"2016-04-19 01:15:20","While these disagreements aren't old, exactly, they don't really seem recent enough for a response just now...is there a reason for why this week in particular?","5609"
"2016-04-19 01:15:50","No, they can not, there is nothing illegal about it. 

But.... The reason for why they are being secretive and mysterious with their money can. (What they're trying to hide can put them in jail)
","7951"
"2016-04-19 01:28:08","These types of shows put on by Russia's military have been common for a while. They've been happening between NATO and Russian aircraft, ships, and submarines. Here is an article that just shows the incidents from March 2014 - November 2014... there were at least 40 (http://www.independent.co.uk/news/world/europe/full-list-of-incidents-involving-russian-military-and-nato-since-march-2014-9851309.html)","7951"
"2016-04-19 02:03:42","THey are also trying to show how weak the U.S. is currently and they only have until January 20, 2017 to cement whatever gains they can get from the current weakling. Consider what happened when Ronald Reagan was elected.","7827"
"2016-04-19 07:03:49","The [wikipedia page](https://en.wikipedia.org/wiki/Manifesto) can give you some ideas. But I am afraid that any questions about the specific form of the publication will be largely opinion-based and depends on your intended target. If you're new ideology presents some complexity, you might consider an [essay](https://en.wikipedia.org/wiki/Essay).","5741"
"2016-04-19 08:02:34","Where have you seen the news? The issue is hardly new or Russian centric (during the Cold War USA planes did often enter Soviet airspace); usually the military like to do those things because a) it allows them to gather intelligence about the opponent reaction and b) they like to show off.","6259"
"2016-04-19 08:32:49","@sabbahillel could you please quote A SINGLE GAIN that Russia has got out of those incidents? I notice USA is in campaign mode, but that should not be an excuse for spreading baseless FUD.","6259"
"2016-04-19 08:40:00","Also, https://en.wikipedia.org/wiki/Medgaz","6259"
"2016-04-19 09:25:56","Some people seem to think that having a private insurance is good enough and the people is to blame, but reality is not that simple.

TL/DR Let's put it this way: if you do not trust your bank to return your money to you... why do you think your insurance firm will be able to do so? To avoid people not trusting the bank the FDIC exists.

First, to understand: there are two types of issues with banks:


Crash/Bankruptcy: The bank owes $X. The assets of the bank (including money that the bank has borrowed) are less than $X.
Bank run: The bank owes $X. The assets of the bank are more than enough to pay $X, but most of them are not liquid enough (they are mostly as loans that will be paid in the coming months or years). By some cause, people loses trusts in the bank and wants to retire all of his money, and the bank cannot pay because not all of his assets can be converted to money so quickly.


The bankruptcy will be caused by the bank taking too much risks or by mismanagement, the bank run may be completely unrelated to the actual health of the bank.

Now, if the bank goes down in a period of economic growth, maybe insurance firms can take the hit. But the fact is that banks are most likely to go down during depression times (people and business who borrowed money fill for bankruptcy and the money will not be returned). So, what happens then?

Well, your insurance company did not take your money and bury it in a hole, waiting to need it. They invested it, most probably in conservative strategy. In other words, the insurers money is in the banks.

So Bank A crashes, and the insurers go and retire money to pay the claims. Now Bank B or C, who were more or less surviving the depression, find that suddenly they have lost a lot of liquidity, and that may find trouble returning people deposits. Some people are aware of it and go to the bank to ensure that they are the first in line to get their money back... and now Bank B and/or C are under too. Guess what happens next?

Other point of the issue is that insurance fees are calculated on the basis that disasters are few and strange. To put it simply: if a hurricane strikes your town and 10% of the homes are demolished, to make it even your insurance fee would be to have 10% of the cost of rebuilding your house (I do not know how much you pay but I bet not that much). If it is not and such a disaster exists, your insurance provider may very well go under, too. That is why special measures are taken for natural disasters. A bank going under is not a natural disaster, but (unless for small banks) it usually affects so many people that its effects are similar. The ""too big to fail"" term is not a meaningless one (that said, if a bank ""too big to fail"" fails, there should be a inquiry into the reason and a punishment for mismanagement if that happened).

Add to that the typical corporate shennanigans (remember when credit agencies gave A+ qualifications to everything their customers put in the market?) Ask for private insurance, and you will get the insurance offered to you in the bank office, by an insurance firm that is so closely tied with the bank that will have not funds when something happens.

And finally, imagine this scenario: you open your mail, and read a letter from your insurance company telling you that the fee for insuring your money in Bank A has gone from 0.1% to 0.5%. What would you do?


Nothing, because you are sure that if something happens your insurance company will pay you.
Run to the bank and get your money out of there as quickly as you can, fighting the hordes of customers trying to do the same, before the increased risk materializes.


Also it is worth noting that many people do not have that much money to deposit. If you tell someone that, added to almost null interest, they will have to pay for insurance to ensure the $20K that are their life savings,  most probably many people will retire their money and store it at home.

OTOH, you cannot either go without ensuring at least partially the deposits, because that way any rumour (with base or without it) risks causing a bank run. At the appearance of even the slightest hint of recession, all people would retire their money from the bank and a total collapse would happen.
","6259"
"2016-04-19 09:44:23","@Eikre but from a practical POV, either a) the representative does not know of the applicants and only can read the reports (and in this case, there is no need for a representative to do this task) or b) those with connections to the representative have an unfair advantage. Maybe in 1780 there were only 20 people who were educated, in the correct age range and white in any state, and all of them knew a representative because the only way to get an education was being from a rich family; but in the XXIst century it just looks strange.","6259"
"2016-04-19 13:38:28","Sanctions against Iran for nearly 50 years? That'd extend back into the time of the Shah.","270"
"2016-04-19 14:01:44","@SJuan76 Who said anything about a gain. It is a matter of how a bully behaves towards a weakling. It does not have to be logical. it can also be a way of setting up for future confrontations.","7827"
"2016-04-19 14:12:38","@sabbahillel `Who said anything about a gain.` Yourself, in your previous comment: `to cement whatever gains`. And well, calling the USA ""a weakling"" while **it spends more in Defense that the following nine countries combined** maybe is a little missinformed...","6259"
"2016-04-19 14:20:34","@SJuan76 I said ""whatever gains"". That means whatever they can get. I do not know what those gains might be. It is a matter of the personality of the bully. Also a ""weakling"" is not in terms of **physical** strength but a matter of character. It is not a matter of spending more money or having weapons but about the ability to actually **use** that physical strength properly. The current ideas about the two men (as expressed implicitly or explicitly) seem to be *rootin' tootin' Putin* and *mommy jeans Obama*. Whether or not this is true or false, it is a matter of perception.","7827"
"2016-04-19 14:43:49","Such an extension of the border would have no impact ? I am quite sure that the UN would not be happy if England was recovering a part of Africa like this.","7921"
"2016-04-19 15:27:44","It is not just republicans attacking her emails...","169"
"2016-04-19 15:41:28","Let us [continue this discussion in chat](http://chat.stackexchange.com/rooms/38579/discussion-between-sjuan76-and-sabbahillel).","6259"
"2016-04-19 15:44:53","@SJuan76 mostly from people posting links to articles on my Facebook feed. It makes way more sense if it's a common thing, though","5609"
"2016-04-19 16:41:16","National socialism is not socialism. Socialism means that the means of production are controlled democratically.","5722"
"2016-04-19 17:05:45","@WillNess Communists and individualist anarchists advocate for free association, or *a community of freely associated individuals* as Karl Marx used to call it.","5722"
"2016-04-19 17:12:33","Comments are not for extended discussion; this conversation has been [moved to chat](http://chat.stackexchange.com/rooms/38586/discussion-on-answer-by-chad-why-do-some-criticize-kasichs-advice-to-a-female-c).","193"
"2016-04-19 17:14:52","[Bernie Sanders is more of a social democrat](http://sandersisnotasocialist.com). Democratic socialism can have several meanings, but in contrast to social democracy, it advocates for abolishment of capitalism through gradual reforms, whereas social democrats like Bernie Sanders seek to reform capitalism without the end goal of abolishing it.","5722"
"2016-04-19 17:32:00","There are fifty states in America, plus some territories and other locations that are given delegates for the primaries.  Yet they each have different rules about how delegates are allocated.  Why?
","6599"
"2016-04-19 18:08:22","Why not? Each state is treated as an independant entity and can set up its own rules.","7827"
"2016-04-19 18:26:31","I can see details of upcoming business in the House of Commons at http://calendar.parliament.uk/, but how does this translate to votes/divisions that subsequently take place?

Is there a record of planned votes in the Commons, or do votes occur spontaneously as a result of debate? I had presumed that for a Whip to be effective, there would need to be clearly defined details of upcoming scheduled votes. If votes are scheduled and predictable, is there a definitive http://www.parliament.uk source for this information?
","7956"
"2016-04-19 18:27:52","@TellyneckBendosack so what happens when I associate, make a crucial and lasting contribution, then disassociate? Who's reaping the fruits of *my* ""labor"" then, and why should they?","1880"
"2016-04-19 19:31:24","The web site has the schedule for particular pieces of legislation or discussion based on what the status of the debate has reached. For example.

Progress of Public Bills this session


  Progress of Public Bills List: 15 April 2016 (PDF PDF 397 KB)
  
  This list was last updated on Friday 15 April 2016 by the House of
  Commons Enquiry Service, Tel 020 7219 4272.


Enterprise Bill returns to the Lords 


  19 April 2016
  
  The Enterprise Bill will return to the House of Lords on Tuesday 19
  April for consideration of Commons amendments in 'ping pong'.
  
  Lords members will discuss MPs' amendments relating to apprenticeships
  and Sunday working.

","7827"
"2016-04-19 19:44:32","You ask why rather than how. I will assume that you know that each state sets its own rules (subject to the main party rules) as shown below. 

The parties enforce national rules to a certain extent, but leave many details up to the states. Before going into why I will summarize the current national rules. Otherwise some people think that the national rules are completely rigid or that it is a complete free for all at the state level.

How Political Party Convention Delegates are Chosen


  Delegates to the national conventions are selected at the state level,
  according to rules and formulas determined by each political party's
  state committee. While these rules and formulas can change from
  state-to-state and from year-to-year, there remain two methods by
  which the states choose their delegates to the national conventions:
  the caucus and the primary.


Democrats use a proportional method. Each candidate is awarded a number of delegates in proportion to their support in the state caucuses or the number of primary votes they won. However, the decision to use the primary or caucus method is left up to the state. There are also some states that use winner take all (or most) method). States also differ as to whether the proportion is calculated statewide or by district.

Democratic Detailed Delegate Allocation give the detailed national rules. Within these rules, each state may set up its own rules.

Democratic Delegate Selection and Voter Eligibility


  The rules of the Democratic National Convention call for the following
  formula to be used in determining the allocation of delegate votes to
  each jurisdiction sending a delegation to the Convention.
  
  Each jurisdiction with electoral votes is assigned a number of Base
  (delegate) votes based on an ""Allocation Factor"" multiplied by 3,200
  [Call Rule I.B.] arrived at through a calculation
  
  To summarize, half of a jurisdiction's base vote is determined by the
  number of Presidential Electors assigned to that state and half are
  computed by the number of people who voted for the Democratic
  Presidential candidate in the last three elections.


The Republican rules require that the delegates be chosen by primary, caucus, or convention. Some states (such as Colorado) use a series of conventions at the lowest level that choose the delegates to the convention  at the next highest level. This culminates in a statewide convention to choose the delegates to the national convention (though this is the only one that the popular media cover). Proportional representation can mean statewide or by individual district or a combination of methods.

Republican Delegate Allocation

Republican Detailed Delegate Allocation


  
    These rules appear to state that delegates must be elected by
    winner-take-all or proportional primaries, caucuses, and conventions.
    Direct delegate election by primary is also permitted.
  


The main reason is that the United States was set up as a federal republic in which each state is regarded as an independent political entity. Each state chooses the delegates of the state in the same way that it elects its own representative. As a result, they would refuse to allow any one outside the state to dictate the rules for delegate allocation. If the national party hierarchy attempted to enforce uniform rules, such as all states must be ""all for one"" or ""statewide proportional representation"" or ""proportional representation by congressional district"", the party would fall apart as the individual states objected to being told what to do.

As a result, the national party sets general rules and limits, and the individual states determine the rules for the following election cycle.
","7827"
"2016-04-19 19:55:56","In fact states don't have rules, the state parties do and the rules differ between the two major parties.","4533"
"2016-04-19 23:27:49","Voting (""divisions"") on the various parts of Bills depends on whether there is consensus within the relevant House, and can take place at any time when Parliament is in session. The Leader of the House (Commons or Lords) plan the timetable to consider legalisation, normally a no more than a week in advance. 
","5538"
"2016-04-20 01:19:21","Representatives may not know the applicants before the process, but they have every chance to know them after the process.  And that still doesn't address the problems with every other system:  that they give power to the people making the decision.  If not the elected representatives who already have all sorts of power, who should get it?  You could make an objective formula from things like SAT scores and grades, but are those really the best predictors of success in the military?  This isn't an education -- it's officer training.  People wanting an education can go elsewhere more easily.","4666"
"2016-04-20 12:49:50","@Brythan I rewrote it to point out that both parties enforce **national** rules. However, many details are left to the states. I pointed out (in brief) the national rules and where the details are left to the states. The OP asked why many details are left to the individual states.","7827"
"2016-04-20 13:27:37","it should also be noted that fhe question the woman asked, and the answer Kasich gave are different than what is claimed above","220"
