CreationDate,Body,OwnerUserId
"2016-04-22 13:09:51","As a secular agnostic, I perceive both Islamic State and Saudi Arabia as extremely theocratic Sunni Muslim governments.

But to some people, Islamic State must be offering something that Saudi Arabia doesn't, otherwise people wouldn't be flocking to fight for them (unless they just like fighting for the heck of it). What is it they offer that Saudi Arabia doesn't?
","270"
"2016-04-22 14:03:55","They honestly state that they are at war with the rest of the world, unlike Saudi Arabia which pretends that they are not. Both divide the world into two sections Dar Al Islam (the section undisputably theirs) and Dar Al Harb (Region of War - the area in dispute)","7827"
"2016-04-22 14:25:38","It seems pretty clear to me that creating positive press, and establishing foreign relations ties is campaigning.  There's a lot of Catholics in the US, and going to the Vatican to attend a conference does just that.  Presidential candidates visit foreign nations as part of campaigns all the time.  Ben Carson went to Israel for instance.","7972"
"2016-04-22 14:38:07","Yes and since donald trump is so popular he would make the best president right?","169"
"2016-04-22 14:44:07","I see no real 100% democracy even in 2016 today. Every countries running by any particular system is imperfect and yet we will only enlarge the cons of each other and cover the logical reasoning and methods available that today is easily implementable with out level of technology. All for the gains of 1%. The focus on political power and economy using legislation in laws are forever one step behind to ensure the advantage of minority over the majority.  

The China issue is not about democracy but how much can they had improved till today in such a short time and their current system is proven to be right for this country. Yes. freedom, media control, human rights issue, corruption, injustice are still prevailing but until the rest of the world can stop trading with them or willing to send army in to take over then its pointless to keep talking but rather try and change them faster for the better. 

Democracy had started on a stage of one people one vote in the west and let the majority of people decide. We had set legal age limit on when you can vote through logical reasoning but yet failed to move to next stage when our evolution required a more responsive, rational democratic system. It will need to take into considerations of factors like age ( why a first time voter young man had same voting right as a 70 grandfather contributing.), qualification(professional of all fields can have their own associations or NGOs globally and yet experts view are so minimized and influenced so great greatly by political parties or corporations. We are fast to create profits with bad products and services but take how long to stop or control them (tobacco, bacon and ham and now wifi) Always selling to the poorly informed common people for our convenience of quick profit. 

The format of using western developed countries as a model that the are the current best should not be defined 10/10 but rather what else in term of possibility of IT we use to enhance as the correct perfect score. Then this will also bring the developing nations to accelerate faster for improvements. Eg laws should be enforced using all available statistic on a dashboard to put into stricter punishment when certain crime reach certain level and decrease accordingly if necessary(low possibility again as our population increase worldwide only increase crime rate with more criminals of all kinds).eg Even traffic fines should be based on % of income reported or assets instead of fixed amount that is so unfair to the poor and won't hinder the rich behaviour. Might as well give license for speeding outright.

The main cons of democracy is that 1. as long majority of people allowed, there is few mechanism to stop our current system from implementing new rules that are totally wrong morally, logically or rationally. There need to be same counter force to prevent wrong judgement. Some examples are:If majority vote you are not the child of yr biological parent. technically its possible. If majority agree justin can have 100 wifes or taylor swift can drive over any speed limit, why not? The scale of moral and populism must be managed evenly. 2. the term of 2-5 year of any election is too long to wait for next better option and too hard to bring them any elected ones. Look at the poll figures for any person in elected position for any countries in this century and you realized how hard is it to name one person who exit on non-popularity issue. So what incentive is there to be good man all the way when we can have restrictive terms on reasonable doubts to rotate officers but public can't even rate them properly to bring them down fast enough when required based on few bad decisions. We can have millions of trade daily trading in miliiseconds and yet don't even have people based KPIs rating on all government servants like the rating on bank clerk or Mac cashier with a smiley or grumpy face? Even S &amp; P or Moody standards are what we supposed to be paid by govt and yet till the day banks crushes the rating is still good as even. 

The fault lines of democracy are so clear cut and yet logical reasoning on simple problems that explode into headlines will take years to solve. IT will need be used intensively to help people manage the government errors that results in huge monetary and environmental losses to the people. We are still living in the world where in any countries there is no index to know exactly how many people are there alive, gonna be dead or given birth soon. People are missing in Flight like MH370 and Harry porter name can even come out in the Panama Paper. These solutions won't need scientist to come out with and preventive step can easily be written and modified by experts, but never instant to implement. Justice will never come fast enough and might even take forever while crime take only seconds to commit. Protest and riots are too slow or even easily suppress to make real impact. The level of colluding by govts on a level never will be open to public unless wikileak happen is what we can wish for now. Therefore any fight of democracy, human rights,justice, transparency, climate, animal rights etc are all only tools to bring either left, right or center party in any government down but they all have certain level constraints here or there to individuals. The participation rate of any voting that is so hard to reach the 2/3 or 3/4 level is indications of how dishearten people are really. Life goes on when good and bad  event is still 50/50 in any country.The chance any of us get kill in school or by police in US or by China government is the same. I'm lucky to be born in one of those country singapore that neither will EVER happen. Privilege for 5m and rich one who can migrate here. Case of so successful on international scale and yet silence on global issues to avoid earning the irks of trading partners. Moral obligations that can be proven logically and with available statistics must be integrated into IT for the only solutions to solve all global issues with results in sight.           
","7971"
"2016-04-22 14:46:27","Your argument is also a logical fallacy - Appeal to popularity – You should do this or think this because most people do. For example: “The death penalty is right because a majority of people are in favor of it.” OR “This is the top selling brand of laundry detergent, so you should buy it.” [Source](http://users.drew.edu/sminegar/English_2_SP09_Sect_003/Fallacies.htm)","169"
"2016-04-22 15:34:37","Do you have a source for Democrats claiming credit for civil rights legislation? The Democrats and Republicans sort of ""swapped positions"" in the latter half of the 20th century, and it is now Republicans trying to get rid of civil rights legislation while Democrats try to defend and strengthen it, but I've never heard a Democrat actually claim credit for the original civil rights legislation being passed.","7468"
"2016-04-22 16:03:35","@Chad People really do consider the advice that Kasich gave to be an example of rape culture.  You might not agree with those people, but it is true that they exist.  You might want to explain why they believe what they do, but that's a whole other layer of abstraction, and it's more easily said than correctly done.  Andrew's answer ends at a clear layer of abstraction. it's possible to go deeper into the other layers, but it's perfectly acceptable not to.","193"
"2016-04-22 16:09:10","@Era During the election campaigns of the past 40 years the Democrats have lied about their behavior from before the civil war up to the 70's or 80's. They range from having pretended to have supported Martin Luthor King Jr., pretending to take credit for the civil rights legislation that the Republicans passed while Johnson was President, hiding what Woodrow Wilson did, etc.","7827"
"2016-04-22 16:10:54","Can you provide evidence?","7468"
"2016-04-22 16:12:15","@Era Just from having lived through the campaigns and hearing what the Democrats claimed.","7827"
"2016-04-22 16:22:14","Your answer strays too far off topic.  This question is about China, and whether or not there's any merit to the claim that ""China is too large to have a democracy""  An answer should be _focused_ on answering that question.","193"
"2016-04-22 17:18:14","That's not evidence. I'm not saying you're wrong, but you need to be able to back up factual claims that you make. Personal experience isn't relevant.","7468"
"2016-04-22 17:42:29","@SamIam it does not answer the question though.","169"
"2016-04-22 18:35:11","@Chad  Yes it does.  The question was why do people criticize Kasich's comments, and the answer was because those people think he's promoting rape culture.","193"
"2016-04-22 18:54:05","I edited the header to match the question title.","4666"
"2016-04-22 19:22:54","Sorry, I might be misinformed, but what are these ""unbound delegates?"" I know about Democratic Party Superdelegates, but I thought that they were exclusive to the Democratic Party.","7966"
"2016-04-22 20:10:10","*I haven't heard about this statement, but I have heard about controversies involving similar statements * - Says no its a guess based on his opinion.","169"
"2016-04-22 20:51:12","@wdg ""China is right"" is in response to the first part of the question, ""Propagand[ists] in China claim that the population is too large for China to have a democracy"", not that their system is better. I'll edit the answer.","2430"
"2016-04-22 21:09:46","Does it matter? Don't you know about the [divine right of politicians](https://en.wikipedia.org/wiki/Divine_right_of_kings)?","2430"
"2016-04-22 21:43:09","The United States is one of very few countries in the world taxing their citizens (and permanent residents) abroad. 

It looks like in 2014, the Republican National Committee voted on a resolution to end this, and instead introduce residence-based taxation.

What is the position of the Democratic Party and/or individual Democrats, such as presidential candidates Hillary Clinton and Bernie Sanders, on this issue?
","7974"
"2016-04-22 22:05:50","I would imagine they would want to tax citizens of other countries if they could.","2430"
"2016-04-22 22:14:32","They don't. One: [MOTHER CHARGED WITH FELONY FOR HELPING HER DAUGHTER ORDER ILLEGAL ABORTION DRUGS ONLINE](http://feministing.com/2014/02/19/mother-charged-with-felony-for-helping-her-daughter-order-illegal-abortion-drugs-online/). Two: [MS: US women charged with murder following miscarriage](https://www.wsws.org/en/articles/2011/07/misc-j06.html). Three: [IN: Women jailed for miscarriages](https://www.rt.com/usa/women-shuai-pregnant-life/). Four: [El Salvador: Where women may be jailed for miscarrying](http://www.bbc.com/news/magazine-24532694).","2430"
"2016-04-22 22:19:29","Do *parties* have official positions? I totally know what you're asking -the title just struck me funny in a year where we're actually seeing massive dissent on policy issues within parties.","3"
"2016-04-22 22:23:22","@Jaydles in Germany, it's quite common to say ""party x now officially has position y"". Forgive me, I'm still relatively new to this country. :)","7974"
"2016-04-22 22:28:28","Trump has a 67.6% chance of winning the Republican nomination. 

https://electionbettingodds.com/


  Last updated: 6:23PM EDT on Apr 22, 2016



","2430"
"2016-04-22 23:12:53","There will be party platforms after the conventions.  They may not take a position on this issue though.  If you really want to know about a particular individual, I'd suggest calling either the campaign or a journalist who can ask the campaign.  Or in the case of incumbent legislators, you could call their office.","4666"
"2016-04-22 23:17:31","Some delegates are not bound to vote for any particular candidate (e.g. the district delegates in Pennsylvania).  Some states allow delegates to run as uncommitted.  Also, when candidates drop out, their delegates are often left unbound.  And of course for most delegates, they lose their bindings after the first ballot.","4666"
"2016-04-22 23:19:54","It would probably be more accurate to say that ElectionBettingOdds.com gave Trump a 67.6% chance of winning the Republican nomination.  Your post makes it sound more precise than it is.  Note that the current number is 69.2%.","4666"
"2016-04-22 23:20:29","Well sure, after the crisis, US/Cuba relations were nearly irreparably damaged, causing an extension and expansion of sanctions and embargoes against Cuba (1). You might say, however, that it was just one step of many that have worked against the Cuban economy and culminated with the dissolution of the Soviet Union (5). 

Cuba had established ties with the Soviet Union in '59 (2) which caused tensions and hostilities before and leading up to the missile crisis. This was also the first year that Fidel Castro came into power via the Cuban Revolution(3), and the Soviet Union was reportedly surprised to find that they could have an ally so close to the US (2).

The Soviet Union took pride in the defense and support of Cuba (2):


  The defense of Cuba became a matter of prestige for the Soviet Union, and Khruschev believed that the U.S. would block all access to the island whether by sea or air. Even in the 1980s the Soviet aid wasn't very important, but rather a regular trade with Cuba of more than $8.5 billion in 1989 was reached. But already in 1990 the trade was reduced to $4.5 billion.[5]


The Soviets tried to help (2):


  Washington's increasing economic embargo led Cuba to hurriedly seek new markets to avert economic disaster. Castro asked for help from the Soviets and in response Khrushchev approved the temporary purchase of Cuban sugar in exchange for Soviet fuel. This deal was to play a part in sustaining the Cuban economy for many years to come.


The ""Special Period"" (4):


  The dissolution of the Soviet Union hit the Cuban economy severely. The country lost approximately 80% of its imports, 80% of its exports and its Gross Domestic Product dropped by 34%. Food and medicine imports stopped or severely slowed. The largest immediate impact was the loss of nearly all of the petroleum imports from the USSR;[2] Cuba's oil imports dropped to 10% of pre-1990 amounts.[3] Before this, Cuba had been re-exporting any Soviet petroleum it did not consume to other nations for profit, meaning that petroleum had been Cuba's second largest export product before 1990.


A blogger (7) wrote:


  If you want to take a step back into automotive time, then you need to go to Cuba. That’s a rule in the automotive industry. Havana itself is beautiful, with its brightly colored—if slightly dusty—buildings and milling streets, but there is nothing quite as beautiful as seeing a line of classic cars sitting at an intersection like it’s no big deal.


Why are there so  many old American cars in Cuba? (6):


  Until the 1960 embargo, most new vehicles came to Cuba from the United States until the 1960 United States embargo against Cuba ended both importation of cars and their parts. As many as 60,000 American vehicles are in use,[10] nearly all in private hands. Of Cuba's vintage American cars, many have been modified with newer engines, disc brakes and other parts, often scavenged from Soviet cars, and most bear the marks of decades of use.[11] Pre-1960 vehicles remain the property of their original owners and descendants, and can be sold to other Cubans providing the proper traspaso certificate is in place. Such transactions can be difficult, but in 2010, reforms were expected to legalize the sale between Cuban citizens of all cars.[12]



WikiPedia: United States embargo against Cuba: https://en.wikipedia.org/wiki/United_States_embargo_against_Cuba
WikiPedia: Cuba–Soviet Union relations: https://en.wikipedia.org/wiki/Cuba%E2%80%93Soviet_Union_relations

","7975"
"2016-04-22 23:35:37","Although the claimed events seem to be true, this answer desperately needs further expansion. The OP asks for specific evidences how the missile crisis and the Cold war affected (or not) Cuban economy, so please consider adding some numbers (statistics) and credible references.","2984"
"2016-04-23 00:09:26","I think, actually, one of the major reasons for Bernie Sanders' victory in the Democrats Abroad primary was his approbation of a residence-based taxation plan. I am not too certain as to the party establishment's position, however.","7747"
"2016-04-23 00:40:48","True, but it's the intention of specific people looking for only specific answers to only serve their specific intention that we have all sorts of NGOs with so called specific solutions and yet still in a mess today. My perspective is boarder but not totally irrelevant like I'm talking about cats and dogs here.","7971"
"2016-04-23 00:45:11","Just adding a link to [what Trump actually said](http://politics.stackexchange.com/questions/10436/what-exactly-did-donald-trump-say-about-abortion), so shows up in related questions.","220"
"2016-04-23 00:50:13","Many countries in Europe are closing their borders to refugees after a spur of right-winged political movements. However, the principle of non-refoulement states that a state must accept someone who is escaping a well-founded fear of persecution. How does this work?
","7976"
"2016-04-23 00:54:51","Where does this ""legal obligation"" come from? And what is meant by ""prosecution?"" Is it really prosecution that those people are trying to escape?","7966"
"2016-04-23 00:57:39","@ostrichofevil Here is the definition: http://www.unhcr.org/3ae68ccd10.html I believe that almost all of Europe has signed this.","7976"
"2016-04-23 00:59:52","I'm just not sure that a war that does not directly target civilians counts as prosecution.","7966"
"2016-04-23 05:01:23","Did you mean persecution? Additionally, you've conflated refoulment with a different concept.","6738"
"2016-04-23 05:19:33","I had bulleted most for you to refer to in case you have questions/comments/suggestions/links to related supporting articles/evidence to add and need making reference to my diverse solutions, and I will add in according if good.

Introduction

1.The project will look at 3 components: People, Government, Business employed/self-employed. It can be created under a single platform which is big enough or on different ones if the features face restrictions.  The aim is not to create a new technology but to duplicate the best/ available ones which are free, licensed or purchased at low cost to be fused into the whole system. Focus on 100% (as definable) transparency, accountability and build on a credible reputation in which the whole system of operation is verifiable and certified based on which ever highest standard eg ISOs available and improve on it. We are looking to solve the main issues in income inequality, public safety, climate and sustainable environment, crime rates, unemployment, resource management etc.

2.Everything in this world can be faked and misuse for crimes. Protection of individual privacy is one of the greatest excuse that had been crested to keep everyone isolated and even more prone to harm. The level of sophistication in the crimes that can be imagined are so creative that there is no regulations that are enticed into laws fast enough to keep pace. 100% freedom and human rights are impossible and we can gauge and monitor all aspect of the society using facts and statistics. Then proceed to create all scenarios of feasible, possible solutions as options that can gain traction for the different environment to which people can choose to implement, on personal, work or government issues. All revolutions, riots and protest are started by most people of logical and rational reasoning ability to address the unjust and unfair treatment or environment they are in. Therefore we should use every scientific and morally right means to justify every action in a democratic way as possible. 

3.The main features of google docs, watapps/wechat, facebook, survey monkey, ERPs,CRMs, POS, Fedex parcel tracking, GPS, dashboard, KPIs, MMORPG game format(eg second life), E-wallets, Singpass system (form of secured login method), biometric, online banking, smartphone app module, cloud database, IOTs, online camera monitoring, youtube, alibaba etc are what I look to create on this single platform or design separately but linkable. Exclude all high definition graphic or visual aspect as they are not required. The common database will also act as alternate channel to obtain national statistic where in the today world that current government is unable to provide accurately. For all the available technology, OS, software that already exist, the initial stage will focus on identifying them in all areas and setup the database that can manage all the data which will be used to explore the advantages. In the design of the platform, we just need to focus on being the 2nd best as much as possible while the actual product that is already out there could still be used as a supplement if required. Feasible new features better than the actual is bonus.

4.The initial founders or core members will have to contribute on a goodwill voluntary basis due to fact that this project will need to look at the bigger picture of giving earth management a better option that till today all problems and crisis that existed are going to be what we want to prevent in the future. The aspect of crisis management will be deeply shaped into our system that we will go forward as a whole that can influence the decisions making already being in place in real world by countries or governing bodies, directly. Once funding stabilized then we look at providing stable income for all involved in a merit based system according to measured contribution against market rate.

5.Never create what you can’t control is the principal and the approach that our audience will be all living 7B people currently on Earth. Target participation will be half the population of each country where the registration reach will start of the actual system regardless of level of completion.  The initial target will be half the population in any country and based on our main concept of transparency, accountability, credibility set always a level higher than current official standards anywhere. Marketing will be based on giving free credit like the gaming industry, setting a scale over a person lifetime to define different stages and level to create and maintain interest. Initial funding will be from the charity community where we will have online instant figure to provide to the public on the income and expense where no one had done before. An online website where we not only show accounts, but also every actual details in operations.      

6.Due to the scale of the project, different stages for different country will be set 1-10 and resources (human, fund) will set assigned by priority ranking. Any qualified person can come into this project at different part/stage and contribute accordingly (full time, part time, volunteer basis) Currently I will only list the 1st stage as I can only do that much alone without any fund available to put the project onto the implementation stage. But I believe it’s still possible to start off with current technology and connectivity of internet to the mass public if done correctly. My ideal currently is to spread this concept/vehicle of my ideology as wide as possible for people to either start off on their own or partner/sponsor me. I believe me as the driver will be the main difference to the extent this goal can be reach and I don’t mind other to reach the destination before me for the better of mankind. Therefore open source, crowdsourcing, transparency and accountability is my main emphasis. The existence of all different charities and NGOs but with similar purpose show there is always a niche I can create differently.

Stage 1:
-   Get professional editor to format my write up into proper format. 
-   Identify available platform, software- 1 year +
-   Recruit volunteers and like-minded people to form a team of 100s of all fields to brainstorm and improvise
-   Create website to obtain donations, choose a forum to create an interactive open source community that work specific for this project
-   Source of funding is open as long it does not affect the overall direction of the project.
","7971"
"2016-04-23 05:29:46","please refer to link for full write up and I welcome all comments/suggestion/links to supporting articles in efforts to make this more complete. https://plus.google.com/103161605064965362019/posts/4D6Ue1fZKHD","7971"
