CreationDate,Body,OwnerUserId
"2016-04-15 00:46:49","Anarcho-Capitalism is not ideologically representative of the Black Panters.

Like. At all.


  We Want An End To The Robbery
  By The Capitalists Of Our Black Community.


That's point number three of the Ten-Points Program, a manifesto written by Black Panther founders Huey Newton and Bobby Seale. I don't know how much more direct you can make it.

The Black Panthers were Marxists, students of a school of conflict sociology. AnCaps and other neoliberals will characterize an essential conflict in government vs. private interest, but that is not, precisely, fundamental to the Marxist conceit. Rather, the essential conflict is class based, with capitalism being the most recent development in exploitation. For Marxists like the Black Panthers, racism is not just some kind of hateful whimsy that only becomes violently destructive when the government jackboots get in on it. Rather, it is itself a product of capitalist self-interest. 

You've heard of how ""workers must seize the means of production,"" right? In chattel slavery, such as was practiced in the American South, the workers are indistinguishable from the means of production; they're owned as property in exactly the same commodified manner as a plantation field or a cotton 'gin. Racist exclusion was no less useful for maintaining an exploitable underclass after the civil war, either. For example, the prisoner leasing programs provided slaves-in-all-but-name as a direct byproduct of racist belligerence among law enforcement. The draft during the Vietnam War press-ganged thousands of young men to fight the enemies of capitalism, but passed over people who were in university, which, generally speaking, did not include a lot of black people. Finally, because obviously there are also plenty of working-class white people, racism is a method of division which foils any effective anti-capitalist sentiment by stirring up proletariat infighting.

Pursuant to the last point, I'll also note that, as time went on, the Panters curved away from Black Nationalism and into Revolutionary Internationalism. Yes, the Black Panthers were anti-establishment, but not because they were merely laissez-faire. They were anti-establishment because, in their opinion, the establishment in question was a longstanding edifice of capitalist values. The answer, for them, is not to simply open up a power vacuum where that government stood, if it just means that the consolidated power of the bourgeois withstands the move to ""anarchy"" and starts cutting deals to trade food to people in return for their eternal bondage. That's just a regression. Rather, to the Black Panthers (and other Marxist groups), the answer is solidarity among the exploited class and opposition to the ideologies which created a class disparity, of which racial disparity is only one kind. That doesn't mean you don't have a government. For many, it means you run one.

So, to answer your question:


  Why don't black people embrace anarcho-capitalism when it would encourage groups like the Black Panthers?


Because the only way an anarcho-capitalist encourages an actual Black Panther is by provoking him.
","7611"
"2016-04-15 02:00:36","There are some elected officials who choose not to use a holy book.

Notably, John Quincy Adams recounted that he had used a volume of constitutional law, with the implication that he was swearing on the principles of constitutionalism itself. Franklin Pierce did not swear an oath at all, exercising the nuance of a constitutionally-mandated option to merely affirm the oath. 

That this distinction was honored is, itself, important, because there actually is a difference. By definition, swearing is a divine invocation. This is a point of some religious significance to sects such as the Anabaptists, who foreswear the taking of oaths in compliance with the Sermon on the Mount. Keep in mind that the reason some of these sects put down roots in the New World in the first place was to escape religious disenfranchisement. So, owing to the same impulse as the First Amendment, Article II of the constitution recognizes that is not necessary to swear an oath, because it would be a point of religious qualification. Contrariwise, you might look to the example of Charles Bradlaugh, an English parliamentarian-elect who was found incapable of swearing an oath (and thus, qualifying for his office) because he didn't believe in the god that he was required to swear it to!

What I'm getting at, here, is that all of these people who have sworn oaths on the bible have done entirely so because it was their personal choice, not because any of it (even the swearing itself) is mandatory. In theory, anyway. Herbert Hoover and Richard Nixon were both Quakers, which would ostensibly direct them to affirm. Nonetheless, they both conformed to convention and chose to swear. Could this indicate a de-facto religious pressure on the office of President? Well, yeah, of course, but it's also possible that neither of those men placed much importance by the nuance. Times change. 

Either way, if one does make the choice to swear in, it is only natural to substantiate it upon a holy text.

We may have Washington to blame.

For some of the prominence of such conventions, that is. You see, the actual content of the President's inaugural oath is constitutionally mandated:


  Before he enters the Execution of his Office, he shall take the following Oath or Affirmation:—""I do solemnly swear (or affirm) that I will faithfully execute the Office of President of the United States, and will to the best of my Ability, preserve, protect and defend the Constitution of the United States.""


Wait, is something missing? As related by Washington Irvine, our first President apparently thought so. After he took the oath, he kissed the bible he'd sworn on and intoned ""so help me god!"" Concluding with such words remains a tradition to this day, though it is of course completely extraneous to that which is directed by law.
","7611"
"2016-04-15 02:15:32","Trump has a plurality, not a majority.  He doesn't have 90% of the needed total but about 60% of what is needed.  He has 90% of the delegates that he should have collected so far in some models (e.g. Cook Political and 538).","4666"
"2016-04-15 03:06:15","I don't think that election pre-pollling is that exact of a science","193"
"2016-04-15 04:07:20","@Jasper My curiosity is not about my program, though.  It's about more of a vague curiosity out how far is the lowest bound before even an official would consider a measure absurdly precise.  Like so many of my questions, probably doesn't really belong anywhere, though.  Anyway, I appreciate your answer very much. I find, indeed, 0.01 feet to be quite absurdly precise.  I was unfamiliar with the term 'chain of offset' so thanks for that.  Incidentally, I always assumed GIS was a specific program, used by college types, geologists and civil engineers and the like.","7889"
"2016-04-15 04:35:40","FiveThirtyEight did a reasonably good job of analyzing this for the bound delegates.  It doesn't really cover the unbound delegates.  

I'm not going to repeat the analysis they give there.  It is certainly possible for Trump to make it to 1237 purely with bound delegates.  He would need to win 479 of the 744 remaining or 64%.  But their analyses suggests that he will fall about 80 short.  Assuming that there are about 200 unbound delegates on the first ballot, he would therefore need about 40% of them to make a majority.  

So Trump either needs to outperform their expectations by about 20% or he needs to convert enough unbound delegates to make up the difference.  

New York is an instructive example.  538's path to 1237 has Trump winning 91 of 95 delegates from New York.  But if he finishes third (or second with the first place finisher over 50%) in one district and second in another, he'd get 0 of 3 and 1 of 3 respectively.  That would take him down to 90.  Even if he finishes first in five districts but below the 50% mark, he'd only get 2 of 3 delegates in each district and fall short.  Polls show Trump with 50% to 60% of the vote statewide, averaging about 54%.  At 60% he might have enough to make 50% in each district, but at 50% he almost certainly wouldn't.  If he falls short of 91 delegates in New York, he'll have to make up those delegates elsewhere.  

I haven't seen congressional district level polls of Trump support, even though that would be what's needed to predict his vote totals in New York and other states that award delegates by congressional district results.  Most projections are going to be somewhat weak without that kind of data.  

I saw on the news today that the Trump campaign is currently projecting themselves at 1265 bound delegates.  This remains possible.  It is certainly much more likely than that Cruz will pass Trump before the convention.  But it's a steep climb.  

I don't see how Trump can expect to get more than a 100 unbound delegates on the first ballot.  That would mean that he needs at least 1137 bound delegates.  And that may give him more support than he really has.  He tends to do worse in conventions and other circumstances where people can't vote for him directly.  He might well find himself stuck at 60 unbound delegates.  That would mean that he needs 1177 bound delegates.  That's about 20 delegates ahead of the 538 projection.  

You may hear a lot of talk about rule 40b.  Most of it is rather confused.  First, Cruz has won a majority of the delegates in seven states already:  Texas; Kansas; Maine; Idaho; Utah; Wisconsin; Colorado.  He also will likely get the vote of a majority of the Louisiana delegates (having signed all ten of the unbound delegates) and seems well poised for victory in Wyoming.  Either would allow him to met the requirement.  

Second, rule 40b doesn't prevent votes for any candidates.  It prevents them from receiving floor nominations where they get to talk on television (as covered in 40c) and from having their names read in the vote count (rule 40d).  In 2012, Ron Paul was short of the eight states but he still received 190 of the first ballot votes.  While Kasich, Cruz, and other potential candidates may appreciate getting to talk on television, they won't need to talk on television to reach delegates.  They can talk to delegates directly.  

In terms of other rules, I wouldn't expect them to have much effect either.  The rules committee won't want to give the appearance of changing the rules for this election.  In fact, I suspect that they won't want to give the impression of rules affecting the election in any way.  

Trump also has the problem that if he doesn't win on the first ballot, many of his delegates (and everyone else's) become unbound.  This is why many observers think that the first ballot is his best if not only chance to win the nomination.  If he can get to 1237 then, he wins.  If not, he probably doesn't.  
","4666"
"2016-04-15 06:03:26","@Bregalad `Also the Soviet Union collapse was a peaceful one` North Ossetia, Chechnya, Tajikistan civil war, Georgia civil war, Abkhazia, South Ossetia, Karabakh, Transnistria - is this peaceful?!","6304"
"2016-04-15 06:30:51","@user4012 As far as I am aware, immigrants pay the same taxes as the UK citizens but do not receive the same benefits. The net effect of that is that they actually help pay for the benefits received only by the citizens.","6218"
"2016-04-15 06:42:42","Are you implying that integration is the more rational one among all irrational assertions?","6218"
"2016-04-15 12:24:14","In the last week ,2 religion based strange incident took place at 2 different parts of the country. Let me tell them one by one.


In Kollam district of Kerala state Kollam Hindu Temple Fireworks Blast incident took place in which More than 100 people were died. Few days before of incident taking  place, district collector and the district police commissioner of Kollam district refused permission for cracking of Fireworks . But as these 2 officer were Muslims and festival was of Hindus, some people and politicians gave it a communal color and demanded for dismissal of these 2 officer. People done celebrations with Fireworks and the bad incident took place.
In the 2nd incident where the Hindu devotee woman wanted to enter inside the core of the  another Hindu temple named as Mahalaxmi Temple in Kolhapur district of Maharashtra state for praying .But temple administration refused to permit her as they think that it is against Hindu culture. But with the Court's order the district collector and district police commissioner of Kolhapur district helped her to get inside the core of the temple.  But while entering the core of the temple the Hindu woman devotee was badly beaten by the people . Here,both these officers are from Hindu religion who helped that Hindu devotee to enter inside the Hindu temple. But after that some people as well as politicians are demanding dismissal of both district collector and district police commissioner. 


Here,as a bystander I really don't understand how to summarise the religion based Indian politics from these 2 incidents. What conclusion can be drawn from it? Also,How can the religious conflict be minimized in India like secular country to maintain the peace and amity?
","7905"
"2016-04-15 14:23:28","What kind of analysis? Does India have ""established"" religion in which each religion has a government office devoted to that religion, as in Britain? In that case, one would have to follow the rules of the central office. Did the officers make their decisions based on civil rulings? How did they justify the decisions? Were they on a secular basis or pretending to decide what the religion would decide?","7827"
"2016-04-15 14:27:14","@Relaxed: what I had in mind is where one Schengen-area country issues residency permits to non-EU nationals which allows unrestricted access to all other Schengen-area countries.","5538"
"2016-04-15 14:30:15","Nice writeup.  It could probably use a TLDR summary, but I can't think of any other aspect of the situation I'd want to see mentioned.","2130"
"2016-04-15 15:45:20","@sabbahillel Sir, India is a secular Democratic country. No  religion is bigger than Indian Constitution. Every Indian person is equal for law. But like other countries ,India is also facing religious conflict.","7905"
"2016-04-15 15:47:40","It is difficult to know what the second report refers to: you seem (and the ""watchimmigration"" website seem to imply that it because of sons of immigrants being returned to the origin country, but it will also apply to sons of UK-born people who have emigrated to other countries (maybe you should start a ""watchemigration"" website?","6259"
"2016-04-15 15:51:57","That is similar to Britain and the U.S. In Britain as an example, everyone is equal under the law, but each religion is under the guidance of the government office set up for that religion. Thus, a synagogue is under the chief Rabbi, a mosque under the chief Imam, etc. These offices (while treating each religion as equal under the law) set up the rules for the synagogue, mosque, or temple. Given your examples, the police or courts would consult the rules provided by that religion's office for guidance as to what would be done.","7827"
"2016-04-15 15:58:15","In the U.S it would be more difficult. However, the question would be as to what the rules are for that religion. Thus, the first example might maintain that it would be forbidden to use fireworks (since it is ""only"" a custom) but would allow ""communion wine"" even if normally liquor is forbidden since it is a **requirement** of the Catholic church. Hindus could not forbid Muslims to eat cow meat but Muslims could not force a Hindu caterer to serve meat (though the U.S. dispute on same-sex marriage may lead to that circumstance). Your second case would depend on who sets the temple rules.","7827"
"2016-04-15 16:07:15","@Relaxed added your improvements, thank you.","6259"
"2016-04-15 16:12:36","@Daria that is exactly what Schengen is about. But note that the requirements for getting Schengen visa are not at the discretion of the country issuing a visa, they are common. Also note that (as stated above) there are restrictions in that the visa has to be issued by the ""intended"" destination; someone asking a Schengen visa (let's say a student one) in Italy may take a trip to visit Paris, but enrolling in a university at France would mean a certain risk of their visa application being considered deceptive and the visa being cancelled.","6259"
"2016-04-15 16:17:46","Consider that Rubio wants to keep his delegates bound so they cannot go to Trump on the first ballot. That is why he is being careful not to **endorse** Cruz while hinting he would **prefer** Cruz over Trump. Also consider the delegates signing they **personally prefer** a certain delegate even if the state has been won by another candidate. The could affect the 8 state rule.","7827"
"2016-04-15 16:42:06","I really do not know how this is different from other religious people in other countries. Even in western countries, every time a new law against homosexual discrimination is discused we have plenty of people claiming that supporters are evil people bent on destroying morality, family and everything that is sacred. It mostly seems than in India religious people still have not been made to accept the supremacy of the civil laws and so they act against the laws, but (hopefully) it will be just a matter of time and education.","6259"
"2016-04-15 17:02:26","OK, here I go again but the legal basis for the Schengen area is actually more complex than that ;) There is no “Schengen treaty” but two different treaties, the Schengen *agreement*, which was just a broad declaration, and the *convention* implementing the agreement which actually created the Schengen area. To make matter more complex, the whole thing was later integrated into EU law so that, by and large, the main basis for the rules governing the area nowadays are not those treaties but two EU *regulations*.","4533"
"2016-04-15 17:04:01","The UK Government responded:

The accusations made about the Government and Prime Minister in this petition are wrong, and the Fixed-Term Parliaments Act means no Government can call an early general election any more anyway.

The Government and Prime Minister have never sought to mislead the public. Nonetheless, the Fixed-Term Parliaments Act, which came into force in 2011 under the Coalition Government, removed the power to set the general election date, and therefore to call an early general election, from the Government and gave a power to the House of Commons to call an early general election in certain circumstances.

An early general election can only be called under the Act if either a motion (as worded in section 2(2) of the Act) that there shall be an early parliamentary general election is passed by the House of Commons with at least two thirds in favour of the motion; or if a motion of no confidence (as worded in section 2(4) of the Act) is passed by the House of Commons and the House does not pass a motion of confidence (as worded in section 2(5) of the Act) in the Government or an alternative Government within 14 days. Aside from these triggers there is no way to replace the Government through an early General Election.

Cabinet Office
","7884"
"2016-04-15 17:32:47","Question universally ascribes the interest of expanding the government to every Democrat and Republican.","6738"
"2016-04-15 17:35:53","The US President is limited to 2.5 terms (10 years).
This may be a problem for a Vice-President stepping up, because if he has to take up the post of the US President too soon, even in the best case he will be in office less than 2 terms.

A cunning Vice-President could side-step the issue, being the Acting President for a while and becoming President only later, so he may be in office for all practical purposes for over 2 terms.

Is this even allowed? For how long can the Acting President postpone becoming the US President?  
","7934"
"2016-04-15 18:48:45","This would be a much better answer if you could provide links to substantive information. As noted by @bilbo_pingouin, opinion isn't a great source for answers.","5309"
"2016-04-15 19:22:14","The way I see it, even though the question is asking **about** opinions, It is not asking for **your** personal opinion.  I consider that to not be the kind of ""opinion based"" that we close for, so I'm reopening it.","193"
"2016-04-15 19:27:19","As a life-long citizen of the United States, I can tell you that the American public in general considers slavery to be a very bad thing.


Slavery is Illegal according to the 13th Amendment to the Constitution of the United States.  
The chattel slavery of the 1700s to 1800s is considered to be a great national shame.  There might be some people who secretly believe slavery isn't that bad, but to say that slavery is not bad is such a taboo to the general public of the United States that almost nobody who believes that would dare say it out loud.  

","193"
"2016-04-15 19:59:49","@user4012 Does the EU recognize China's sovereignty in Tibet? If yes, then it wouldn't be ""occupied territory"" from EU's point of view. Probably a helpful comparison is Crimea, whose annexation by Russia is not considered legitimate.","5071"
"2016-04-15 20:03:37","Actually found out that the EU [prohibits import from Crimea](http://www.consilium.europa.eu/uedocs/cms_Data/docs/pressdata/EN/foraff/143342.pdf). So, over the occupation of Crimea, the EU implemented a much harsher measure than simply requiring labelling.","5071"
"2016-04-15 20:04:53","This is the text of the 22nd amendment, the part of the Constitution that deals with this.  


  Section 1. No person shall be elected to the office of the President more than twice, and no person who has held the office of President, or acted as President, for more than two years of a term to which some other person was elected President shall be elected to the office of the President more than once. But this article shall not apply to any person holding the office of President when this article was proposed by the Congress, and shall not prevent any person who may be holding the office of President, or acting as President, during the term within which this article becomes operative from holding the office of President or acting as President during the remainder of such term.
  
  Section 2. This article shall be inoperative unless it shall have been ratified as an amendment to the Constitution by the legislatures of three-fourths of the several states within seven years from the date of its submission to the states by the Congress.


See the bolded part.  So long as the vice president acted as president for more than 2 years, that person cannot be elected more than one additional time.  Whether or not he can become the official president late or not is moot.
","193"
"2016-04-15 20:15:08","
  1- What do today's Americans think about slavery?


Most think it's bad. 


  2- Are there any bad feelings among some whites against blacks?


Yes. 
","1530"
"2016-04-15 20:49:20","@Relaxed: We may be at cross purposes. An EU citizen may reside in a land mass that is not contiguous to the continent of Europe: see https://ec.europa.eu/europeaid/regions/octs_en and a citizen of a non-EU country may reside in a Schengen area (eg Norway). As such, EU vs non-EU is woolly, and Schengen vs non-Schengen is also woolly.","5538"
"2016-04-15 21:46:42","I know Black Panthers don't believe in anarcho-capitalism or even capitalism, but that doesn't preclude them from existing and no one is going to bother them if the organization is voluntary and they do not aggress against others. Even communes will exist in anarcho-capitalist societies.","2430"
"2016-04-15 22:35:40","@Chloe Your explicit premise was that the embrace of Anarcho-Capitalism by Black Americans would encourage the Black Panthers. If you know that AnCaps *wouldn't* promote the Black Panthers, why would you predicate a question on that assertion? I'm plenty interested in shaping my answer to meet your fullest inquiry, but if you're going to backpedal, then please do me the courtesy of admitting you're revising your opening position. It's not fun to be found inadequate of a question that hasn't actually been asked.","7611"
"2016-04-15 22:42:57","I haven't edited the question. I assume black people dislike being murdered by government cops. Anarcho-capitalism encourages choice and selection among police, and I assume black people would flock to the Black Panthers as an alternative to racist cops. Without a centralized government to systematically wipe out Black Panthers, they can grow their ranks and 'customer' base.","2430"
"2016-04-15 22:47:13","@Chloe Very well. So you're interested in why there aren't more Black people embracing *Anarchy* (irrespective of Capitalism), given that it would open up a space that could be filled with *Black Nationalism* (with which the Black Panthers had an early dalliance, prior to their more long-lived interest in Marxist intersectionalism). Am I correct?","7611"
"2016-04-15 22:52:13","Yes, any form of anarchy is fine. I personally prefer the capitalism kind, but without a monopoly government, no one is going to stop me from practicing capitalism. Why don't more darker shade people embrace anarchy which would allow Black Panthers to exist?","2430"
