CreationDate,Body,OwnerUserId
"2016-04-15 23:25:26","@Chloe. Cool, yeah. Let me try to find some spare time, I'd like to elucidate. I might like to underline the dissonance AnCaps have with other flavors of Anarchist, but the answer after that starts looking more like the other two that have been offered. It ties into a broader disaffection with radicalism, and the particular history that Black Americans have had with Federalism. What it comes down to is that Anarchy doesn't have a ubiquitous place in American/Black politics, so, in order to popularize Anarchy, you actually need to *start* by organizing activists, which is what the Panthers are.","7611"
"2016-04-16 08:40:58","@Daria I still don't get your point. It's complex but not at all woolly or in any way a problem for EU aims. Also note that what's special about some oversea territories is that they are under the control of a member state while not being part of the EU. The fact that the people living in those territories are EU citizens is neither here nor there, EU citizens can obviously reside anywhere in the world.","4533"
"2016-04-16 08:43:22","I am also very surprised about the objections raised in the comments. The question is a bit broad but otherwise a lot more objective and answerable (e.g. based on the sociological literature, surveys, etc.) than most questions asked on this site. +1 from me.","4533"
"2016-04-16 08:51:51","thank you  Relaxed. I am also very surprised since this question is similar to other one (that linked). that question is about Germany and has not such objections. but this is about U.S and...","7739"
"2016-04-16 08:54:38","Or to say the same thing in another way: All this just seem like technical details without any great political significance to me.","4533"
"2016-04-16 10:04:34","@wdg so [China not considered to be democratic?](http://politics.stackexchange.com/questions/10546/is-china-considered-to-be-democratic)","7739"
"2016-04-16 15:15:57","@user1, of course not... were you joking?","4249"
"2016-04-16 16:08:02","Yes. People collect SS without paying in one cent. A spouse who never worked a day in their life can collect 1/2 of their working spouse plus the working spouse gets all of theirs. Example; John collects $2,000 SS per month. His spouse never worked but collects $1,000 SS per month and John get his $2,000. That means $1,000 is paid from the fund even though no payment was paid into the fund by the spouse. And we wonder why SS is almost broke.
","7936"
"2016-04-16 16:37:02","so can you answer the question?","7739"
"2016-04-16 17:22:39","I think the objections are that it's just a broad and, arguably lazy question. People think all sorts of things, but in general, people think slavery is bad.","1530"
"2016-04-16 21:26:52","Suppose a prospective candidate for US President goes through the entire primary process and easily obtains enough pledged delegates to win their party's nomination in the first round of convention voting. 

Then, just days before the convention is due to open, some information becomes public about the candidate that makes the candidate completely unelectable in the November general election.  Say, continuing massive unreported off-shore accounts, revealed as part of the Panama Papers leak. Or incontrovertible  evidence of seeking and accepting bribes in a previous government position.

Would the convention be bound to proceed with the nomination based on the direction of the primaries?  Or could they somehow shift to a more viable nominee?
","4402"
"2016-04-16 21:52:32","Also, if the working spouse dies, the non-working spouse will receive the full benefit.  I.e. the $2000 in your example.  But it's not quite true that nothing was paid in for the non-working spouse.  Spousal benefits have always been part of the system.  You could just as well say that people without non-working spouses are leaving money on the table.  It's much newer that both spouses work.  The reason why Social Security is running out of money is because people are living longer but not paying more.","4666"
"2016-04-16 22:39:43","Yes, but...

Assuming the candidate doesn't drop out on her or his own:

The delegates have complete control over the convention.  They could vote in a rule prior to the nomination vote that said that the candidate was not eligible and vote in someone else.  Many of them may still be bound to vote for that candidate, but the rules would say that the candidate could not win.  There is no rule saying explicitly that having enough bound delegates to make up a majority of the delegates awards victory.  

For example, if Hillary Clinton is convicted of abuse of classified information after winning 2383 bound delegates in primaries, her own delegates could vote in a rule precluding anyone convicted of a felony from winning the nomination.  They'd be bound to vote for her on the first ballot but that wouldn't count.  Most would be unbound on later ballots and could vote for someone else.  That someone else might be Bernie Sanders but not necessarily.  They could pick someone else entirely.  

To continue, Clinton could then turn state's evidence against Donald Trump on a bribery charge.  Trump gets convicted too but has at least 1237 bound delegates.  The Republican delegates modify rule 40 to exclude votes for convicted felons.  Some of the delegates may be unbound immediately, e.g. Minnesota and Oklahoma are only bound if the candidate is nominated.  Cruz, Kasich, or some other candidate could be nominated.  

Note:  neither scenario is likely.  This is just a semi-realistic chain of events to illustrate what could happen.  

All that said, if either party did this, they'd need a really good reason to avoid a backlash.  They'd probably try hard to get a unanimous decision on the rule change so as to provide cover against charges of interfering with the election.  They'd specifically try to recruit the previous supporters of the candidate to be removed.  
","4666"
"2016-04-17 01:19:06","Related question, though specifically about the GOP (and implicitly about Donald Trump) http://politics.stackexchange.com/questions/10055/is-the-republican-party-forced-to-support-whoever-wins-the-presidential-primary","270"
"2016-04-17 01:29:02","Recently, presidential candidate John Kasich fielded a question from a young college student about what he will do as president regarding sexual misconduct on college campuses. A video of what Kasich said can be found at ABC News.


  WOMAN: ""Being that I am a young female college student, What are you going to do in office as President to help me feel safer and more secure regarding sexual violence, harassment, and rape.""
  
  KASICH: ""In our state. We think that when you enroll, you ought to absolutely know that if something happens to you along the lines of sexual harassment or whatever, you have a place to go, where there is a confidential reporting, where there is an ability for you to access a rape kit, where that is kept confidential, but where it gives you the opportunity to be able to pursue justice, after you have had some time to reflect on it all.""
  
  KASICH: ""And we are in a process of making sure that all higher education in our state, and this ought to be done in the country, that our co-eds know exactly what the rules are, what the opportunities are, what the confidential policies are, so that you are not vulnerable at risk and can be preyed upon.""
  
  KASICH: ""I have two sixteen year old daughters, and I don't even like to think about it.""
  
  WOMAN: ""It's sad that it's something I have to worry about just walking...""
  
  KASICH: ""I'll also give you one bit of advice. Don't go to parties where there's a lot of alcohol.""


Some people have been critical of his remark. Could anyone help explain why his advice might be offensive and how he could have worded his advice?
","7937"
"2016-04-17 02:44:37","I haven't heard about this statement, but I have heard about controversies involving similar statements by public figures, and most likely he is being accused of promoting rape culture, by telling potential victims of rape what to do, which is interpreted as blaming the victim for being raped, rather than focusing on the actions of rapists.
","270"
"2016-04-17 04:28:19","it is no more patronizing than saying, ""teach men not to rape."" As if men don't know it is wrong to rape. The standard answer here is that radical feminist consider teaching any woman precautionary measures to prevent her own rape is victim blaming, rather than prudent steps to lower your risk. The fact is that alcohol and drug consumption are highly correlated with rape and attempted rape in college campuses (don't have the studies on hand, but 7x-20x higher risk ratio of being raped.)","220"
"2016-04-17 06:38:02","From what I understand, Hillary Clinton and her supporters demanded that Bernie Sanders release his tax return, suggesting that he was refusing to do so and was hiding something, even though the demand was made before April 15th and the tax return may not have even been written yet. Bernie promptly complied with the demand and it apparently contained nothing interesting after all.

This seems to just make Hillary Clinton look bad as it is an opportunity to contrast Bernie's (relatively) mundane Senator's salary and Social Security benefit to her great wealth, and his apparent transparency with her steadfast refusal to release her Wall Street speech transcripts, which Bernie and his supporters have been demanding for months, and the seeming motivation for the tax return demand.

Was this strategy of attack successful and I'm just not aware of it? What did they believe they would find in the Sanders tax return? Why did they think this was a good strategy to attack Bernie?
","5046"
"2016-04-17 08:35:55","Although I have sympathy for refugees trying to enter Europe, but why all media are showing only their bad conditions and struggle? Why don't they show about those local people too who are suffering due to migrants? There have been cases like in Germany and France.
","7940"
"2016-04-17 10:44:57","@Downvoter: I was describing the most likely explanation as to why the politician would be criticised. I wasn't supporting or opposing that criticism. So why downvote this answer?","270"
"2016-04-17 12:16:14","Could you elaborate on what suffering exactly you mean and how you learned about it (since, as you say, it isn’t reported in media)?","7825"
"2016-04-17 14:52:21","Got here through you comment in my question. Unfortunately, I cannot answer your questions. I don't think it is diplomatically wise for UN to classify countries as democratic or not since Russia and China are permanent members of UN security councils. Not sure about official US stance. A US based NGO Freedom House publishes ""freedom in the world"" regularly. Also, the Economists publishes ""democracy index"".","4249"
"2016-04-17 15:28:05","Sounds more like a rant bordering on conspiracy theory than a genuine question, -1 from me. But to to take your question at face value, the simple answer is that we are talking about *millions* of people suffering as a result of an on-going war, including many losing their lives. Anything that can properly be called “a case” doesn't really compare. Are you saying hundreds of people have died in France as a result of the crisis?","4533"
"2016-04-17 15:29:58","Incidentally, the media did extensively report the events in Cologne around New Year's eve or the tensions in the Calais area.","4533"
"2016-04-17 17:13:52","Why isn't Hillary Clinton releasing the transcripts of her paid Goldman Sachs (Wall Street) speeches? If she wins the Democratic nomination, she risks facing these questions again in the general election campaign, especially if there is something damning in those speeches.
","5846"
"2016-04-17 19:01:29","Feminists (no need to be especially *radical*) consider that it's a problem that women constantly have to worry about “preventing their own rape”, as if it was not the rapist or the broader society's problem. Also, avoiding parties where alcohol is consumed is not merely a “prudent step”, it's a choice between living (what is still considered) a normal life and your personal safety, a choice men don't have to make in the same way.","4533"
"2016-04-17 19:05:40","The argument sounds a little more plausible and reasonable on the surface but it's just one small step up from blaming women for wearing skirts and generally provoking men's lust (which incidentally is not necessarily the main motivation of rape). Even if you think it's best not to party too hard (and personally I certainly think so), it's still victim blaming, no way around that. Of course, you don't hear such discourse about other crimes (think theft, drug trafficking, child abuse, you name it), then it's all about the perpetrator's agency and punishment…","4533"
"2016-04-17 20:57:11","Worse that what you described, Bernie's total income was less than one Hillary speech to a bank. What you are seeing is Hillary and her team are clueless.","5510"
"2016-04-17 20:58:08","The same reason she used her own mail server for official business.","5510"
"2016-04-17 21:03:12","@user3344003 Ya makes sense.","5846"
"2016-04-17 22:52:02","@origimbo - That's valid.  It also has nothing to do with the answer you posted, which is specifically about the electoral college.  Generally, it also only affects delegates to the national convention for the party - once the convention votes, that's *probably* the end of per-state involvement.  Both the answer and your comment are good answers, but they're not relevant to *this* question.  ""Is there anything in the GOP or Democrat rules and bylaws that allows for a candidate **that has been nominated** to be recalled?"" (emphasis mine)","2130"
"2016-04-17 22:53:02","I think this is a great question, but I don't think it's answerable by anyone outside her immediate circle.  Anything else would just be speculation.","2130"
"2016-04-17 22:56:30","I'm not sure this question is definitively answerable by anyone outside her inner circle of advisors, but there's enough precedent for demanding tax returns as a campaign strategy that there could be a good answer based on what's been revealed by other candidates' taxes.","2130"
"2016-04-17 22:58:45","That last paragraph is very important.  Just because the delegates *can* do all this, doesn't mean that there won't be massive backlash.  They'll want to do as much justification and covering of themselves as possible.","2130"
"2016-04-18 01:27:15","
  Why did they think this was a good strategy to attack Bernie?


They probably didn't.  They likely thought that it would change the conversation at the time.  They had been talking about her failure to release transcripts for her speech.  As a gambit, it was mildly successful although the moderator did ignore it in the immediate followup.  

It also allowed her to make the statement that she had complied with the actual requirements while Bernie hadn't.  

I strongly suspect that the net result is going to be nothing.  Hillary supporters will stay Hillary supporters; Bernie supporters will stay Bernie supporters.  Bernie supporters will have reactions similar to yours.  Hillary supporters will say that she shouldn't make herself vulnerable to Republican attacks based on things she said in the transcripts.  
","4666"
"2016-04-18 01:39:28","I doubt that she knows of anything in particular that is problematic.  The issue is that it is likely that if she released the transcripts, she would have said something, sometime that Republicans could criticize.  

Look at what happened in 2012 when a recording of Romney talking at a fundraiser was released.  The 47% statement became a meme for the Obama campaign.  

Or look at what happened with her emails.  She sent an email that Republicans use to accuse her of suborning the misuse of confidential information.  

Or her superpredator comments from 1994.  

Talking is dangerous for a politician.  She doesn't have to have been plotting a crime.  She could have simply said something that sounds bad.  For example, if she commiserates with her listeners about something, she could be accused of putting rich people problems ahead of poor people problems.  
","4666"
"2016-04-18 03:19:16","
  I'm Jesse Talavera-Greenberg, and I approve of this message.


If I were running for US president, would I have to say that in my televised campaign ads?  If so, why?
","6599"
"2016-04-18 04:45:56","You don't need that exact statement, but per 52 USC § 30120(d)(1)(B) you do need to have


  a statement that identifies the candidate and states that the candidate has approved the communication. Such statement—  
  
  (i) shall be conveyed by—
   (I) an unobscured, full-screen view of the candidate making the statement, or
  (II) the candidate in voice-over, accompanied by a clearly identifiable photographic or similar image of the candidate; and
  
  (ii) shall also appear in writing at the end of the communication in a clearly readable manner with a reasonable degree of color contrast between the background and the printed statement, for a period of at least 4 seconds.


This requirement exists so that people know who is behind slimy ads. If you want to run an attack ad against your opponent, you have to be willing to put your face on it and stand behind whatever you said. It was a lot less effective than was hoped (independent ads have since become a much more prominent part of the political landscape, so candidates don't need to get their hands dirty because supportive super PACs can do it for them), but that was the idea.
","3093"
"2016-04-18 06:04:12","Added to address the new context provided by the edit

Based on the edit that provided more context as to the exchange that actually occurred, I would say three things:


His answer does a good job of addressing ways in which he thinks victims should be helped.
His answer is still lacking because it doesn't provide a plan for addressing the root cause, just for helping victims. To re-use the analogy below, he's saying that we should provide ways for victims to report being mugged, but he's not offering advice on how to reduce mugging.
The last statement he made is still troubling, even in this context, for the reasons laid out below.


Original answer below

You and some friends want to go check out an area of town that has a great restaurant, movie theater, bar, club, etc., but the location of the venues are in an area that has a reputation for being a rough part of town. Being social creatures, you really want to check this place out because you think it will be a lot of fun. Along the way you get mugged.

In this example, Kasich's advice would be,


  ""I will give you one bit of advice. Don’t go to a part of town where
  there’s a lot of crime.""


Certainly following this advice would reduce your risk of getting mugged, but it would also cause you to miss out on many social gatherings. In this example, is the problem that you went to a rough part of town, or is it that this part of town has a higher crime rate? Should our public figures be advocating avoiding that part of town or ways in which we can reduce the crime rate and improve the safety in that part of town?

Rewording the statement won't do because what was said doesn't address the actual issue, it simply offers up advice to try and avoid the problem. It's important to offer advice on how to stay safe, but it's more important to go after the root cause of what is making a situation unsafe.
","2959"
"2016-04-18 07:19:41","""Did they fail — they succeed"", answers above (which could be longer), show that your assumption is not correct. But I want to add some points:  

If we see a revolution or a movement (Arab spring, 99%,...) stopped, it doesn't mean it is failed completely. The protesters are living in the country, some of them satisfied (by media, government arguments,...)  some not; The more a government is sever, the more people will be unsatisfied. The revolution movement could resume any time.  

The ""Arab spring"" suffered from lack of leadership.  

Some reasons differs case by case:   


In Egypt: the previous ruler was overthrew and Morsi elected as President. But he failed to act as people want. (He didn't improve economy. He continued to have good relationship with Saudi Arabia and Israel). Then he lost people's support.  
In Bahrain: United States Navy base in Bahrain +  Saudi Arabia. Note that Population of Bahrain is 1300000, So a little foreign interfere can have big effect.  
In Iran: One revolution succeed in 1979. But the case what you called ""green revolution"", it was not in fact a revolution. In capital Tehran ""Mousavi"" had more votes but in the whole country ""ex-president Ahmadinejad"" had more.  Mousavi refused to accept election results and you saw protests in Tehran. In the other cities there was not serious problems; only some protests with low population. But media exaggerated it as a revolution in country (because Mousavi was pro-western and Ahmadinejad was anti-israel). I was in Northwest of Iran at the time. A friend ask me about those who (he read on the internet) killed. I said there is not even one Wounded; A surprise for him.  
In Yemen: it resulted in civil wars because of ""Saudi Arabia's interfere"" and not being united.  
In Syria: We have  world war not civil war. One side is US, EU, Turkey, Saudi Arabia, ... . Other side is Russia, Iran, Hezbollah,... ; China politically help this side. 

","7739"
"2016-04-18 07:41:07","It seems that the governments of each nation choose their UN representatives however they want to. Is that correct? Was this also the case for the League of Nations?
","7944"
"2016-04-18 13:58:57","Having just heard a radio campaign ad this morning, I'll add that (d)(1)(A) says that radio requires: `an audio statement by the candidate that identifies the candidate and states that the candidate has approved the communication`.  Same idea, but without the visuals.","2130"
"2016-04-18 14:56:39","One goal of the feminist movement is a society in which young women can enjoy the freedom to go to parties with lots of alcohol without being afraid of sexual assault.

While advising women to avoid this environment because it is unsafe is certainly a valid stop-gap measure to protect women from sexual assault in the short term, it comes at the cost of giving up their right to social participation. The long-term goal should be to change society in a way that people consider it a bad idea to sexually assault other people, no matter how drunk the victim or themselves.

That's why feminists react so hostilely to statements like this. The stop-gap measure is presented as a permanent solution to distract from the need for societal change. What feminists would like to hear instead is a statement like:


  ""It is unacceptable that women can not safely go to parties where there’s a lot of alcohol. That's why I propose [measures] to prevent people from committing sexual assault.""


What ""measures"" are appropriate to reach this goal is another topic we could debate about endlessly, but acknowledging that the behavior of the perpetrators should change and not that of the victims is an important first step to reach a better society for everyone (yes, also for the heterosexual men who will certainly enjoy the company of women while getting drunk).
","3135"
"2016-04-18 15:02:43","@chirlu has a point.  In order for us to properly answer this question, we need to know specifically which struggles the locals are dealing with, and it would be useful to have something that documents that.","193"
"2016-04-18 15:02:50","But the problem is this isn't asking what you think the problem might be it is asking why it is being criticized.  So this is a very bad answer.","169"
"2016-04-18 15:13:17","@Relaxed You hear it all the time about other crimes.  If your bike is stolen and you didn't lock it up, you will _literally_ get victim blamed.  I.E. people will literally say ""it's your fault for not locking it up"".  For identify theft, victim blaming is even more socially acceptable than that.  For Mugging and Murder, you get the exact same advice that's so controversial about rape,","193"
"2016-04-18 15:32:28","@user1873 if you're going to make that correlation then you should clarify and point out that it's drunk college *men* that are the primary culprit.","1530"
"2016-04-18 15:33:11","@SamIam you do. But those other crimes aren't particularly lopsided when it comes to the sexes.","1530"
"2016-04-18 15:39:55","Because of reasons she hasn't explained to us.","1530"
"2016-04-18 16:10:32","You answered the question in your first sentence: ""suggesting that he was refusing to do so and was hiding something"". That's often the entirety of the strategy in situations like this.","1530"
"2016-04-18 16:24:40","
  Would the convention be bound to proceed with the nomination based on the direction of the primaries? Or could they somehow shift to a more viable nominee?


The parties are essentially private clubs. They can shift the rules as needed to accommodate the desires of the leadership. 

This has happened before. And likely will happen again. Granted, they have to weigh their ability to do this against the political will of the party's members. 
","1530"
